,data_tweets,data_labels
212,"The Consumer Financial Protection Bureau, or CFPB, has been a total disaster as run by the previous Administrations pick. Financial Institutions have been devastated and unable to properly serve the public. We will bring it back to life!",0.0
213,"Happy #SmallBusinessSaturday!

A great day to support your community and America’s JOB creators by shopping locally at a #SmallBiz. #ShopSmall ",0.0
214,"Time Magazine called to say that I was PROBABLY going to be named “Man (Person) of the Year,” like last year, but I would have to agree to an interview and a major photo shoot. I said probably is no good and took a pass. Thanks anyway!",0.0
215,"Will be calling the President of Egypt in a short while to discuss the tragic terrorist attack, with so much loss of life. We have to get TOUGHER AND SMARTER than ever before, and we will. Need the WALL, need the BAN! God bless the people of Egypt.",0.0
216,"Horrible and cowardly terrorist attack on innocent and defenseless worshipers in Egypt. The world cannot tolerate terrorism, we must defeat them militarily and discredit the extremist ideology that forms the basis of their existence!",0.0
217,"After Turkey call I will be heading over to Trump National Golf Club, Jupiter, to play golf (quickly) with Tiger Woods and Dustin Johnson. Then back to Mar-a-Lago for talks on bringing even more jobs and companies back to the USA!",0.0
218,"Will be speaking to President Recep Tayyip Erdogan of Turkey this morning about bringing peace to the mess that I inherited in the Middle East. I will get it all done, but what a mistake, in lives and dollars (6 trillion), to be there in the first place!",0.0
219,"Can you believe that the disrespect for our Country, our Flag, our Anthem continues without penalty to the players. The Commissioner has lost control of the hemorrhaging league. Players are the boss! ",0.0
220,Two great people! ,0.0
221,A great guy (with great ratings)! ,0.0
222,RT @DeptofDefense: #HappyThanksgiving from @USArmy and @USNationalGuard #soldiers serving with Task Force Marauder in #Afghanistan. ? ,0.0
223,"RT @Scavino45: Today, @POTUS @realDonaldTrump and @FLOTUS Melania visit the @USCG at the Lake Worth Inlet Station, in Riviera Beach, Florid…",0.0
224,"ObamaCare premiums are going up, up, up, just as I have been predicting for two years. ObamaCare is OWNED by the Democrats, and it is a disaster. But do not worry. Even though the Dems want to Obstruct, we will Repeal &amp; Replace right after Tax Cuts!",0.0
225,"My great honor to join our incredible men and women of the @USCG, at the Lake Worth Inlet Station, in Riviera Beach, Florida today!
#HappyThanksgiving ",0.0
226,HAPPY THANKSGIVING! ,0.0
227,"Will be doing a live Thanksgiving Video Teleconference with Members of the Military at 9:00 A.M.  Afghanistan, Iraq, USS Monterey, Turkey &amp; Bahrain. Then going to Coast Guard Quarters, Florida.",0.0
228,MAKE AMERICA GREAT AGAIN!,0.0
229,@ThePlumLineGS MAKE AMERICA GREAT AGAIN!,0.0
230,"HAPPY THANKSGIVING, your Country is starting to do really well. Jobs coming back, highest Stock Market EVER, Military getting really strong, we will build the WALL, V.A. taking care of our Vets, great Supreme Court Justice, RECORD CUT IN REGS, lowest unemployment in 17 years....!",0.0
231,....And it will get even better with Tax Cuts! ,0.0
232,I have long given the order to help Argentina with the Search and Rescue mission of their missing submarine. 45 people aboard and not much time left. May God be with them and the people of Argentina!,0.0
233,51 Million American to travel this weekend - highest number in twelve years (AAA). Traffic and airports are running very smoothly!  @FoxNews,0.0
234,RT @FLOTUS: Preparations are underway to celebrate the holidays at the @WhiteHouse! ,0.0
235,The @USNavy is conducting search and rescue following aircraft crash. We are monitoring the situation. Prayers for all involved. ,0.0
236,Will be having meetings and working the phones from the Winter White House in Florida (Mar-a-Lago). Stock Market hit new Record High yesterday - $5.5 trillion gain since E. Many companies coming back to the U.S. Military building up and getting very strong.,0.0
237,"RT @IngrahamAngle: “Far right”? You mean “right so far,” as in @realDonaldTrump has been right so far abt how to kick the economy into high…",0.0
238,"RT @Realjmannarino: @realDonaldTrump The ungratefulness is something I’ve never seen before. If you get someone’s son out of prison, he sho…",0.0
239,The NFL is now thinking about a new idea - keeping teams in the Locker Room during the National Anthem next season. That’s almost as bad as kneeling! When will the highly paid Commissioner finally get tough and smart? This issue is killing your league!.....,0.0
240,"...LaVar, you could have spent the next 5 to 10 years during Thanksgiving with your son in China, but no NBA contract to support you. But remember LaVar, shoplifting is NOT a little thing. It’s a really big deal, especially in China. Ungrateful fool!",0.0
241,"It wasn’t the White House, it wasn’t the State Department, it wasn’t father LaVar’s so-called people on the ground in China that got his son out of a long term prison sentence - IT WAS ME. Too bad! LaVar is just a poor man’s version of Don King, but without the hair. Just think..",0.0
242,"Today, we continued a wonderful American Tradition at the White House. Drumstick and Wishbone will live out their days in the beautiful Blue Ridge Mountains at Gobbler’s Rest... ",0.0
243,President Donald J. Trump and @FLOTUS Melania Participate in the Pardoning of the National Thanksgiving Turkey at the White House. ,0.0
244,Under President Trump unemployment rate will drop below 4%.  Analysts predict economic boom for 2018!  @foxandfriends and @Varneyco,0.0
245,Marshawn Lynch of the NFL’s Oakland Raiders stands for the Mexican Anthem and sits down to boos for our National Anthem. Great disrespect! Next time NFL should suspend him for remainder of season. Attendance and ratings way down.,0.0
246,Republican Senators are working very hard to get Tax Cuts and Tax Reform approved. Hopefully it will not be long and they do not want to disappoint the American public!,0.0
247,"Border Patrol Officer killed at Southern Border, another badly hurt. We will seek out and bring to justice those responsible. We will, and must, build the Wall!",0.0
248,Big-game trophy decision will be announced next week but will be very hard pressed to change my mind that this horror show in any way helps conservation of Elephants or any other animal.,0.0
249,"Shoplifting is a very big deal in China, as it should be (5-10 years in jail), but not to father LaVar. Should have gotten his son out during my next trip to China instead. China told them why they were released. Very ungrateful!",0.0
250,"Sen. Jeff Flake(y), who is unelectable in the Great State of Arizona (quit race, anemic polls) was caught (purposely) on “mike” saying bad things about your favorite President. He’ll be a NO on tax cuts because his political career anyway is “toast.”",0.0
251,"Now that the three basketball players are out of China and saved from years in jail, LaVar Ball, the father of LiAngelo, is unaccepting of what I did for his son and that shoplifting is no big deal. I should have left them in jail!",0.0
252,RT @greta: Thank you @realDonaldTrump - this is important to so many of us ,0.0
253,"RT @piersmorgan: BOOM! Thank you, Mr President. Trophy-hunting is repellent. ",0.0
254,"Crooked Hillary Clinton is the worst (and biggest) loser of all time. She just can’t stop, which is so good for the Republican Party. Hillary, get on with your life and give it another try in three years!",0.0
255,Put big game trophy decision on hold until such time as I review all conservation facts. Under study for years. Will update soon with Secretary Zinke. Thank you!,0.0
256,"Today, it was an honor to celebrate the Collegiate National Champions of 2016/2017 at the @WhiteHouse! 
#NCAAChampions?Photos: https://t.co/Ecl2phhzyl ",0.0
257,"Together, we're going to restore safety to our streets and peace to our communities, and we're going to destroy the vile criminal cartel, #MS13, and many other gangs...

'Hundreds arrested in MS-13 crackdown'
https://t.co/Mp268d8RaU ",0.0
258,"If Democrats were not such obstructionists and understood the power of lower taxes, we would be able to get many of their ideas into Bill!",0.0
259,"Great numbers on Stocks and the Economy. If we get Tax Cuts and Reform, we'll really see some great results!",0.0
260,.And to think that just last week he was lecturing anyone who would listen about sexual harassment and respect for women. Lesley Stahl tape?,0.0
261,"The Al Frankenstien picture is really bad, speaks a thousand words. Where do his hands go in pictures 2, 3, 4, 5 &amp; 6 while she sleeps? .....",0.0
262,"Big win today in the House for GOP Tax Cuts and Reform, 227-205. Zero Dems, they want to raise taxes much higher, but not for our military!",0.0
263,Congratulations to the House of Representatives for passing the #TaxCutsandJobsAct — a big step toward fulfilling our promise to deliver historic TAX CUTS for the American people by the end of the year! ,0.0
264,Need all on the UN Security Council to vote to renew the Joint Investigative Mechanism for Syria to ensure that Assad Regime does not commit mass murder with chemical weapons ever again.,0.0
265,"China is sending an Envoy and Delegation to North Korea - A big move, we'll see what happens!",0.0
266,"....your release possible and, HAVE A GREAT LIFE! Be careful, there are many pitfalls on the long and winding road of life!",0.0
267,"To the three UCLA basketball players I say:  You're welcome, go out and give a big Thank You to President Xi Jinping of China who made.....",0.0
268,Big vote tomorrow in the House. Tax cuts are getting close!,0.0
269,Why are Democrats fighting massive tax cuts for the middle class and business (jobs)? The reason: Obstruction and Delay!,0.0
270,It is actually hard to believe how naive (or dumb) the Failing @nytimes is when it comes to foreign policy...weak and ineffective!,0.0
271,"...They should realize that these relationships are a good thing, not a bad thing. The U.S. is being respected again. Watch Trade!",0.0
272,"The failing @nytimes hates the fact that I have developed a great relationship with World leaders like Xi Jinping, President of China.....",0.0
273,Do you think the three UCLA Basketball Players will say thank you President Trump? They were headed for 10 years in jail!,0.0
274,Thank you! ,0.0
275,"Thank you, working hard! ",0.0
276,"While in the Philippines I was forced to watch @CNN, which I have not done in months, and again realized how bad, and FAKE, it is. Loser!",0.0
277,".@foxandfriends will be showing much of our successful trip to Asia, and the friendships &amp; benefits that will endure for years to come!",0.0
278,Our great country is respected again in Asia. You will see the fruits of our long but successful trip for many years to come!,0.0
279,"RT @Scavino45: 20,295 miles later #POTUSinAsia has successfully concluded as @POTUS @realDonaldTrump lands on the South Lawn of @WhiteHouse…",0.0
280,"RT @realDonaldTrump: Unemployment is down to 4.1%, lowest in 17 years. 1.5 million new jobs created since I took office. Highest stock Mark…",0.0
281,"RT @PChowka: Sean Hannity's Big Week - Top Ratings, Probing Reporting, and Let There Be Light at American Thinker ",0.0
282,"RT @realDonaldTrump: Thank you to our GREAT Military/Veterans and @PacificCommand.

Remember #PearlHarbor. Remember the @USSArizona!

A day…",0.0
283,Just returned from Asia after 12 very successful days. Great to be home!,0.0
284,THANK YOU ASIA! #USA?? ,0.0
285,THANK YOU to the amazing staff and their families of the United States Embassy in the Philippines. Keep up the GREAT WORK! ,0.0
286,"One of the most accurate polls last time around. But #FakeNews likes to say we’re in the 30’s. They are wrong. Some people think numbers could be in the 50's. Together, WE will MAKE AMERICA GREAT AGAIN! ",0.0
287,I will be making a major statement from the @WhiteHouse upon my return to D.C. Time and date to be set.,0.0
288,"Just arrived at #ASEAN50 in the Philippines for my final stop with World Leaders. Will lead to FAIR TRADE DEALS, unlike the horror shows from past Administrations. Will then be leaving for D.C. Made many good friends!",0.0
289,"After my tour of Asia, all Countries dealing with us on TRADE know that the rules have changed. The United States has to be treated fairly and in a reciprocal fashion. The massive TRADE deficits must go down quickly!",0.0
290,Great to see @RandPaul looking well and back on the Senate floor. He will help us with TAX CUTS and REFORM!,0.0
291,"Excited to be heading home to see the House pass a GREAT Tax Bill with the middle class getting big TAX CUTS!

#MakeAmericaGreatAgain??",0.0
292,"I am proud of the Rep. House &amp; Senate for working so hard on cutting taxes {&amp; reform.} We’re getting close! Now, how about ending the unfair &amp; highly unpopular Indiv Mandate in OCare &amp; reducing taxes even further? Cut top rate to 35% w/all of the rest going to middle income cuts?",0.0
293,"Happy to announce, I am nominating Alex Azar to be the next HHS Secretary. He will be a star for better healthcare and lower drug prices!",0.0
294,Will be leaving the Philippines tomorrow after many days of constant mtgs &amp; work in order to #MAGA! My promises are rapidly being fulfilled.,0.0
295,"Great day of bilateral meetings at #ASEANSummit on trade, which we are turning around to be great deals for our country! ",0.0
296,Thank you! ,0.0
297,"We had a wonderful visit to Vietnam, thank you President Tran Dai Quang! Heading to the #ASEANSummit 50th Anniv Gala in the Philippines now. ",0.0
298,"Just landed in the Philippines after a great day of meetings and events in Hanoi, Vietnam! ",0.0
299,"Why would Kim Jong-un insult me by calling me ""old,"" when I would NEVER call him ""short and fat?"" Oh well, I try so hard to be his friend - and maybe someday that will happen!",0.0
300,"Does the Fake News Media remember when Crooked Hillary Clinton, as Secretary of State, was begging Russia to be our friend with the misspelled reset button? Obama tried also, but he had zero chemistry with Putin.",0.0
301,"When will all the haters and fools out there realize that having a good relationship with Russia is a good thing, not a bad thing. There always playing politics - bad for our country. I want to solve North Korea, Syria, Ukraine, terrorism, and Russia can greatly help!",0.0
302,"Met with President Putin of Russia who was at #APEC meetings. Good discussions on Syria. Hope for his help to solve, along with China the dangerous North Korea crisis. Progress being made.",0.0
303,"Will be doing a joint press conference in Hanoi, Vietnam then heading for final destination of trip, the Phillipines.",0.0
304,President Xi of China has stated that he is upping the sanctions against #NoKo. Said he wants them to denuclearize. Progress is being made.,0.0
305,"“Presidential Proclamation Commemorating the 50th Anniversary of the Vietnam War” 
??https://t.co/hgUQP9leqK 
??https://t.co/9C0yyIv9Ws ",0.0
306,"On this wonderful Veterans Day, I want to express the incredible gratitude of the entire American Nation to our GREAT VETERANS. Thank you! ",0.0
307,"On behalf of an entire nation, Happy 242nd Birthday to the men and women of the United States Marines!
#USMC242 #SemperFi ",0.0
308,The United States has been reminded time and again in recent years that economic security is not merely RELATED to national security - economic security IS national security. It is vital to our national strength. #APEC2017 ,0.0
309,The United States is prepared to work with each of the leaders in this room today to achieve mutually beneficial commerce that is in the interests of both your countries and mine. That is the message I am here to deliver today. #APEC2017 ,0.0
310,"Today I am here to offer a renewed partnership with America -- to work together to strengthen the bonds of friendship and commerce between all of the nations of the Indo-Pacific, and together, to promote our prosperity and security. #APEC2017 ",0.0
311,"In more and more places throughout this region, citizens of SOVEREIGN and INDEPENDENT nations have taken greater control of their destinies, and unlocked the potential of their people. #APEC2017 ",0.0
312,"Throughout my travels, I've had the pleasure of sharing the good news from America. I've had the honor of sharing our vision for a free &amp; open Indo-Pacific -- a place where sovereign &amp; independent nations, w/diverse cultures &amp; many different dreams, can all prosper side-by-side. ",0.0
313,"Just landed in Da Nang, Vietnam to deliver a speech at #APEC2017",0.0
314,"I am leaving China for #APEC2017 in Vietnam. @FLOTUS Melania is staying behind to see the zoo, and of course, the Great WALL of China before going to Alaska to greet our AMAZING troops.",0.0
315,My meetings with President Xi Jinping were very productive on both trade and the subject of North Korea. He is a highly respected and powerful representative of his people. It was great being with him and Madame Peng Liyuan!,0.0
316,"I don’t blame China, I blame the incompetence of past Admins for allowing China to take advantage of the U.S. on trade leading up to a point where the U.S. is losing $100's of billions. How can you blame China for taking advantage of people that had no clue? I would've done same!",0.0
317,In the coming months and years ahead I look forward to building an even STRONGER relationship between the United States and China. ???? ,0.0
318,"President Xi, thank you for such an incredible welcome ceremony. It was a truly memorable and impressive display! ?https://t.co/J9x51h1LBe ",0.0
319,Congratulations to all of the ”DEPLORABLES” and the millions of people who gave us a MASSIVE (304-227) Electoral College landslide victory! ,0.0
320,Looking forward to a full day of meetings with President Xi and our delegations tomorrow. THANK YOU for the beautiful welcome China! @FLOTUS Melania and I will never forget it! ,0.0
321,NoKo has interpreted America's past restraint as weakness. This would be a fatal miscalculation. Do not underestimate us. AND DO NOT TRY US. ,0.0
322,"On behalf of @FLOTUS Melania and I, THANK YOU for an unforgettable afternoon and evening at the Forbidden City in Beijing, President Xi and Madame Peng Liyuan. We are looking forward to rejoining you tomorrow morning! ",0.0
323,Leaving South Korea now heading to China. Looking very much forward to meeting and being with President Xi!,0.0
324,"Together, we dream of a Korea that is free, a peninsula that is safe, and families that are reunited once again! ",0.0
325,Anyone who doubts the strength or determination of the U.S. should look to our past....and you will doubt it no longer. ,0.0
326,"The North Korean regime has pursued its nuclear &amp; ballistic missile programs in defiance of every assurance, agreement, &amp; commmitment it has made to the U.S. and its allies. It's broken all of those commitments... ",0.0
327,"The U.S., under my administration, is completely rebuilding its military, and they're spending hundreds of billions of dollars to the newest and finest military equipment anywhere in the world, being built right now. I want peace through strength! ",0.0
328,"Join me LIVE in South Korea????
#NationalAssembly #POTUSinAsia 
??https://t.co/M3iEhPdkas ",0.0
329,"Ed Gillespie worked hard but did not embrace me or what I stand for. Don’t forget, Republicans won 4 out of 4 House seats, and with the economy doing record numbers, we will continue to win, even bigger than before!",0.0
330,"Getting ready to make a major speech to the National Assembly here in South Korea, then will be headed to China where I very much look forward to meeting with President Xi who is just off his great political victory.",0.0
331,Thank you to all Americans who participated in Nat'l Rx Drug Take Back Day. A record amount of drugs collected &amp; disposed. We can do this!,0.0
332,"Franklin, such a great photo. 

HAPPY 99th BIRTHDAY to your father, @BillyGraham! ",0.0
333,".@EdWGillespie will totally turn around the high crime and poor economic performance of VA. MS-13 and crime will be gone. Vote today, ASAP!",0.0
334,....and has been horrible on Virginia economy. Vote @EdWGillespie today!,0.0
335,"Ralph Northam will allow crime to be rampant in Virginia. He’s weak on crime, weak on our GREAT VETS, Anti-Second Amendment....",0.0
336,"....is making. Working very hard on TAX CUTS for the middle class, companies and jobs!",0.0
337,Stock market hit yet another all-time record high yesterday. There is great confidence in the moves that my Administration....,0.0
338,Thank you to President Moon of South Korea for the beautiful welcoming ceremony. It will always be remembered. ,0.0
339,"It was my great honor to have lunch with our INCREDIBLE U.S. and ROK troops at Camp Humphreys, in South Korea. ???? https://t.co/5NJirz4iNM ",0.0
340,"RT @AbeShinzo: ????????????????????????????????????????????????????????

?????????????????????????????????????

@realDonaldTrump ",0.0
341,....Some of those they are harshly treating have been “milking” their country for years!,0.0
342,"I have great confidence in King Salman and the Crown Prince of Saudi Arabia, they know exactly what they are doing....",0.0
343,"Getting ready to leave for South Korea and meetings with President Moon, a fine gentleman. We will figure it all out!",0.0
344,"My visit to Japan and friendship with PM Abe will yield many benefits, for our great Country. Massive military &amp; energy orders happening+++!",0.0
345,"The state of Virginia economy, under Democrat rule, has been terrible. If you vote Ed Gillespie tomorrow, it will come roaring back!",0.0
346,#USA?? #Japan?? ,0.0
347,"...Americans do what we do best: we pull together. We join hands. We lock arms and through the tears and the sadness, we stand strong... ",0.0
348,"May God be w/ the people of Sutherland Springs, Texas. The FBI &amp; law enforcement are on the scene. I am monitoring the situation from Japan.",0.0
349,Heading into the 12 days with great negotiating strength because of our tremendous economy. ,0.0
350,It was a true honor to be at Yokota Air Base with our GREAT @USForcesJapan! ,0.0
351,"Playing golf with Prime Minister Abe and Hideki Matsuyama, two wonderful people! ",0.0
352,"Just gave a speech to the great men and women at Yokota Air Base in Tokyo, Japan. Leaving to see Prime Minister Abe. ",0.0
353,I am landing shortly. Can’t wait to be with our GREAT MILITARY. See you soon! ,0.0
354,Would very much appreciate Saudi Arabia doing their IPO of Aramco with the New York Stock Exchange. Important to the United States!,0.0
355,"Unemployment is down to 4.1%, lowest in 17 years. 1.5 million new jobs created since I took office. Highest stock Market ever, up $5.4 trill",0.0
356,RT @IvankaTrump: Touched by the warm hospitality of Prime Minister Abe and the Japanese people. ?????????? [Thank you]! Until next time ??…,0.0
357,"Thank you to our GREAT Military/Veterans and @PacificCommand.

Remember #PearlHarbor. Remember the @USSArizona!

A day I’ll never forget. ",0.0
358,Thank you for such a beautiful welcome Hawaii. My great honor to visit @PacificCommand upon arrival. Heading to Pearl Harbor w/ @FLOTUS now. ,0.0
359,Getting ready to land in Hawaii. Looking so much forward to meeting with our great Military/Veterans at Pearl Harbor!,0.0
360,The decision on Sergeant Bergdahl is a complete and total disgrace to our Country and to our Military.,0.0
361,"JOBS, JOBS, JOBS! ",0.0
362,"The rigged Dem Primary, one of the biggest political stories in years, got ZERO coverage on Fake News Network TV last night. Disgraceful!",0.0
363,"Just took off for ceremony @ Pearl Harbor. Will then be heading to Japan, SKorea, China, Vietnam &amp; the Philippines. Will never let you down!",0.0
364,"I always felt I would be running and winning against Bernie Sanders, not Crooked H, without cheating, I was right.",0.0
365,Bernie Sanders supporters have every right to be apoplectic of the complete theft of the Dem primary by Crooked Hillary!,0.0
366,"...Based on that, the Military has hit ISIS ""much harder"" over the last two days. They will pay a big price for every attack on us!",0.0
367,"ISIS just claimed the Degenerate Animal who killed, and so badly wounded, the wonderful people on the West Side, was ""their soldier."" .....",0.0
368,"Pocahontas just stated that the Democrats, lead by the legendary Crooked Hillary Clinton, rigged the Primaries! Lets go FBI &amp; Justice Dept.",0.0
369,The real story on Collusion is in Donna B's new book. Crooked Hillary bought the DNC &amp; then stole the Democratic Primary from Crazy Bernie!,0.0
370,"....People are angry.  At some point the Justice Department, and the FBI, must do what is right and proper. The American public deserves it!",0.0
371,"...New Donna B book says she paid for and stole the Dem Primary. What about the deleted E-mails, Uranium, Podesta, the Server, plus, plus...",0.0
372,Everybody is asking why the Justice Department (and FBI) isn't looking into all of the dishonesty going on with Crooked Hillary &amp; the Dems..,0.0
373,My Twitter account was taken down for 11 minutes by a rogue employee. I guess the word must finally be getting out-and having an impact.,0.0
374,I will be interviewed by @IngrahamAngle on @FoxNews at 10:00. Enjoy!,0.0
375,The @TuckerCarlson opening statement about our once cherished and great FBI was so sad to watch. James Comey's leadership was a disaster!,0.0
