,data_tweets,data_labels
0,Michelle and I are delighted to congratulate Prince Harry and Meghan Markle on their engagement. We wish you a lifetime of joy and happiness together.,1.0
1,"From the Obama family to yours, we wish you a Happy Thanksgiving full of joy and gratitude. ",1.0
2,"ME:  Joe, about halfway through the speech, I’m gonna wish you a happy birth--
BIDEN:  IT’S MY BIRTHDAY!
ME:  Joe.
 
Happy birthday to @JoeBiden, my brother and the best vice president anybody could have. ",1.0
3,"RT @ObamaFoundation: Today, we honor those who have honored our country with its highest form of service. https://t.co/IbJNCwIofL ",1.0
4,"This is what happens when the people vote. Congrats @RalphNortham and @PhilMurphyNJ . And congratulations to all the victors in state legislative, county and mayors' races. Every office in a democracy counts!",1.0
5,Every election matters - those who show up determine our future. Go vote tomorrow! ,1.0
6,May God also grant all of us the wisdom to ask what concrete steps we can take to reduce the violence and weaponry in our midst.,1.0
7,"We grieve with all the families in Sutherland Springs harmed by this act of hatred, and we’ll stand with the survivors as they recover...",1.0
8,"Starting today, you can sign up for 2018 health coverage. Head on over to https://t.co/ob1Ynoesod and find a plan that meets your needs. ",1.0
9,Michelle and I are thinking of the victims of today's attack in NYC and everyone who keeps us safe. New Yorkers are as tough as they come.,1.0
10,"Hello, #ObamaSummit! Thrilled to host civic leaders in Chicago from all over the world. Follow along at @ObamaFoundation.",1.0
11,"I’ll let you and @ladygaga handle the singing, and we’ll handle the donations. There’s still time to give: https://t.co/o5oCWOtiJS. ",1.0
12,Tonight the ex-Presidents are getting together in Texas to support all our fellow Americans rebuilding from this year’s hurricanes. Join us. ,1.0
13,"I'm grateful to @SenJohnMcCain for his lifetime of service to our country. Congratulations, John, on receiving this year's Liberty Medal.",1.0
14,Michelle &amp; I are praying for the victims in Las Vegas. Our thoughts are with their families &amp; everyone enduring another senseless tragedy.,1.0
15,Proud to cheer on Team USA at the Invictus Games today with my friend Joe. You represent the best of our country. ,1.0
16,"We're expanding our efforts to help Puerto Rico &amp; the USVI, where our fellow Americans need us right now. Join us at https://t.co/o5oCWOtiJS ",1.0
17,"Prosecutor, soldier, family man, citizen. Beau made us want to be better. What a legacy to leave. What a testament to @JoeBiden. ",1.0
18,RT @gatesfoundation: President @BarackObama addresses #Goalkeepers17 starting at 12:40 PM. Tune in here: ,1.0
19,Thinking about our neighbors in Mexico and all our Mexican-American friends tonight. Cuidense mucho y un fuerte abrazo para todos.,1.0
20,"Coding is important – and fun. @CSforAll, thanks for your work to make sure every kid can compete in a high-tech, global economy. ",1.0
21,Michelle and I want the @ObamaFoundation to inspire and empower people to change the world. Here's how we're getting started this fall. ,1.0
22,We remember everyone we lost on 9/11 and honor all who defend our country and our ideals. No act of terror will ever change who we are.,1.0
23,"RT @GeorgeHWBush: Across the U.S., Americans have answered the call to help with hurricane recovery. Praying for all Floridians. #Irma http…",1.0
24,Proud of these McKinley Tech students—inspiring young minds that make me hopeful about our future. ,1.0
25,Americans always answer the call. https://t.co/SV1jixOExu ,1.0
26,"To target hopeful young strivers who grew up here is wrong, because they’ve done nothing wrong. My statement: ",1.0
27,Thank you to all the first responders and people helping each other out. That's what we do as Americans. Here's one way you can help now. ,1.0
28,Michelle and I are thinking of the victims and their families in Barcelona. Americans will always stand with our Spanish friends. Un abrazo.,1.0
29,"""...For love comes more naturally to the human heart than its opposite."" - Nelson Mandela",1.0
30,"""People must learn to hate, and if they can learn to hate, they can be taught to love...""",1.0
31,"""No one is born hating another person because of the color of his skin or his background or his religion..."" ",1.0
32,"John McCain is an American hero &amp; one of the bravest fighters I've ever known. Cancer doesn't know what it's up against. Give it hell, John.",1.0
33,Health care has always been about something bigger than politics: it's about the character of our country. ,1.0
34,"Of all that I've done in my life, I'm most proud to be Sasha and Malia's dad. To all those lucky enough to be a dad, Happy Father's Day! ",1.0
35,"On this National Gun Violence Awareness Day, let your voice be heard and show your commitment to reducing gun violence. ",1.0
36,Forever grateful for the service and sacrifice of all who fought to protect our freedoms and defend this country we love. ,1.0
37,Good to see my friend Prince Harry in London to discuss the work of our foundations &amp; offer condolences to victims of the Manchester attack. ,1.0
38,"Through faith, love, and resolve the character of the people of Manchester has shown itself.  Our thoughts &amp; prayers are with you. ",1.0
39,Our hearts go out to those killed and wounded in Manchester. Americans will always stand shoulder to shoulder with the people of the UK.,1.0
40,"Excited to hear from Sierra, Imani, Filiz, and Benedikt who are making a difference at home and abroad. See you in Berlin! ",1.0
41,"Happy Mother's Day to my love and partner on this journey @MichelleObama, and to all the wonderful, hardworking mothers out there.",1.0
42,"We're rolling up our sleeves again, back where it all started. Join us at https://t.co/GYkEOK8EuT. ",1.0
43,"Well said, Jimmy. That's exactly why we fought so hard for the ACA, and why we need to protect it for kids like Billy. And congratulations! ",1.0
44,RT @ObamaFoundation: It’s a beautiful day on the South Side. ,1.0
45,My heart goes out to the victims and their families in London. No act of terror can shake the strength and resilience of our British ally.,1.0
46,"Chuck Berry rolled over everyone who came before him – and turned up everyone who came after.  We'll miss you, Chuck.  Be good.",1.0
47,"On International Women’s Day, @MichelleObama and I are inspired by all of you who embrace your power to drive change. ",1.0
48,RT @ObamaFoundation: Courage comes in many forms. Who in your local community or neighborhood leads by example? #ProfileInCourage ,1.0
49,Humbled to be recognized by a family with a legacy of service. Who's your #ProfileInCourage? Tell me about them: https://t.co/euYRxWcost ,1.0
50,We asked. You answered. ,1.0
51,"Happy Valentine’s Day, @michelleobama! Almost 28 years with you, but it always feels new. ",1.0
52,I read letters like these every single day. It was one of the best parts of the job – hearing from you. ,1.0
53,RT @ObamaFoundation: Add your voice: https://t.co/mA9MSHmi7o ,1.0
54,"In the meantime, I want to hear what you're thinking about the road ahead. So share your ideas with me here: ",1.0
55,"Hi everybody! Back to the original handle. Is this thing still on? Michelle and I are off on a quick vacation, then we’ll get back to work.",1.0
56,"Tonight, President Obama reflects on eight years of progress. Watch the #FarewellAddress at 9 pm ET: ",1.0
57,"RT @OFA: ""Thanks to the Affordable Care Act, your coverage is better today than it was before.""

Watch the weekly address: ",1.0
58,"In the weekly address, President Obama discusses what #Obamacare has done to improve health care. ",1.0
59,"Let's keep working to keep our economy on a better, stronger course. ",1.0
60,The landmark #ParisAgreement enters into force today—we must keep up the momentum to #ActOnClimate. ,1.0
61,"The economy added 161,000 jobs in October, and wages are up 2.8 percent over the past year. ",1.0
62,There are a lot of plans out there. Check your options and lock in the one that's best for you: ,1.0
63,"The positive impact of #Obamacare is undeniable, but there's one big factor holding many states back: ",1.0
64,RT @POTUS: It happened: @Cubs win World Series. That's change even this South Sider can believe in. Want to come to the White House before…,1.0
65,Tens of millions of Americans have benefited from #Obamacare. Make sure you're one of them. #GetCovered ,1.0
66,"Thanks to #Obamacare, quality health care is available to everyone. The marketplace is now open—make sure you and your family #GetCovered. ",1.0
67,RT @lacasablanca: La t?pica Latina tarda 22 meses en ganar lo que un hombre blanco gana en 12 meses. Tenemos que cerrar la brecha salarial.…,1.0
68,"RT @WhiteHouse: On #LatinaEqualPay Day, we mark the work that remains to ensure that all Americans receive equal pay for equal work. ",1.0
69,Community organizing never goes out of style. Shop now: https://t.co/LXEbQdKLLT ,1.0
70,"With #Obamacare, people can focus on treatment for pre-existing conditions without the fear of coverage being capped or denied. #GetCovered ",1.0
71,"The Obamacare marketplace is now open. If you're uninsured, now is the time to shop for a plan and #GetCovered. https://t.co/7mJYFEz4QS ",1.0
72,RT @FLOTUS: Open enrollment starts tomorrow! Check out your options at https://t.co/dg57hwz5of and share your #GetCovered story. ,1.0
73,Lions and Tiggers and bears! Oh my! #HappyHalloween ,1.0
74,Usted y su familia merecen la tranquilidad de saber que est?n cubiertos. El mercado de seguros abre ma?ana. ,1.0
75,"Speak up in support of quality, affordable health care for all. ",1.0
76,There's nothing to be scared of when searching for health insurance. Three in four people can #GetCovered for less than $75 a month. ,1.0
77,Open enrollment begins tomorrow—make sure you and your loved ones #GetCovered. ,1.0
78,"RT @OFA: Witch plan is best for you? Thanks to Obamacare, even pre-existing conditions can't stop you from comparing your options. #GetCove…",1.0
79,Senate leaders' obstruction of our Supreme Court nomination process is unacceptable. Say so: ,1.0
80,Senate leaders should put the common good above politics—the integrity of our nation's highest court depends on it. #DoYourJob ,1.0
81,Don't ghost on your health and well-being—your chance to #GetCovered is coming up. Open enrollment starts November 1. ,1.0
82,Climate change is happening now. Denial is dangerous. ,1.0
83,"If you're willing to work hard and play by the rules, you should be able to get ahead. ",1.0
84,President Obama lays out just a few of the ways in which #Obamacare has helped millions of Americans. ,1.0
85,New report: Renewable energy installations are beating fossil fuel installations for the first time. ,1.0
86,Obamacare has helped millions of Americans gain the peace of mind that comes with coverage. Show your support: ,1.0
87,"This is what happens when we focus on building an economy that works for everyone, not just those at the top. ",1.0
88,"No one's too wrapped up in pre-existing conditions to #GetCovered. 
Thanks to Obamacare, you can find a plan that meets your needs. ",1.0
89,Help protect the progress we've made in helping millions of Americans get covered. Add your name now: ,1.0
90,DYK: Most people can find a plan for less than $75 per month. Open enrollment starts on November 1. #GetCovered ,1.0
91,"Women, the sick, survivors—they all deserve fair treatment in our health care system. #Obamacare ",1.0
92,Don't get tripped up by misinformation. Join the @OFA Truth Team today: https://t.co/wJZj1QCxXm ,1.0
93,"RT @SecBurwell: Most people shopping on @HealthCareGov will again find plans with premiums of less than $75/month, thanks to financial assi…",1.0
94,Be proud of the progress we've made together—wear the mark of this movement. https://t.co/fYf2O9WAwG ,1.0
95,Strong policies that help working families get ahead are good for our economy. ,1.0
96,The four-week average of jobless claims fell to the lowest level since 1973—a sign of a healthy labor market. ,1.0
97,"Since 2010, America's uninsured rate has been cut in half. Help build on that progress—join Team #Obamacare today: ",1.0
98,"RT @OFA: It's working.
It's saving lives.
And we're not going back.
Retweet to show your support. ",1.0
99,"Health care is a right, not a privilege—and #Obamacare works to protect that right for millions of Americans. ",1.0
100,Don't get tripped up by misinformation. Join the @OFA Truth Team today: https://t.co/09BpA6F9Ne ,1.0
101,Being able to stay on a parent's plan enables millions of young adults to make choices about their future with the security of health care. ,1.0
102,"""Because of Obamacare, another 20 million Americans now know the financial security of health insurance."" ",1.0
103,Stand up for the law that's helped 20 million more Americans gain health coverage. Join Team @Obamacare today: ,1.0
104,"There's still more work to do, but let's celebrate how far we've come. ",1.0
105,LIVE: President Obama is in Miami talking about the progress made possible by the Affordable Care Act. ,1.0
106,"RT @WhiteHouse: Each day, @POTUS reads 10 letters from Americans. Today, we're sharing some of the letters written about #ACA: ",1.0
107,Tune in at 1:55 p.m. ET to watch President Obama speak about the successes of the Affordable Care Act. ,1.0
108,There's a lot of misinformation floating around. Make sure you've got the facts—join the @OFA Truth Team: https://t.co/WKXMJCZtF0 ,1.0
109,"From coast to coast, editorial boards are denouncing Senate obstructionism. Take a look: ",1.0
110,"Our Supreme Court has been short a justice for far too long. #DoYourJob, Senate leaders. ",1.0
111,"RT @SecBurwell: Today, 20M more Americans have coverage thanks to the #ACA. Our uninsured rate is the lowest in our nation’s history. Lowes…",1.0
112,The need for a ninth justice is undeniably clear. #DoYourJob ,1.0
113,We can't afford to let this be the new normal. ,1.0
114,Denying climate change is dangerous. Join @OFA supporters in standing up for bold action now: ,1.0
115,"Climate change is real, but so is the progress we're making to #ActOnClimate. Let's keep it up. ",1.0
116,This is just the latest step forward in the push to #ActOnClimate. ,1.0
117,Read why @FLOTUS is fighting to ensure that girls everywhere have access to quality education. ,1.0
118,"Wildfires in the next few decades could be ""unrecognizable"" to previous generations—because of climate change: ",1.0
119,Senate leaders are blocking the Supreme Court nomination for their own political gain—don't be silent: ,1.0
120,"RT @WhiteHouse: ""Nobody should be priced out of a higher education."" —@POTUS on the progress we've made: https://t.co/4YohVv7Qea ",1.0
121,RT @WHLive: Watch as @POTUS speaks on the progress made to ensure every student has the opportunity to realize their potential: ,1.0
122,Senate leaders have recognized Judge Garland's impeccable credentials in the past. He deserves a fair hearing and an up-or-down vote. ,1.0
123,We need a fully functional Supreme Court. Editorial boards across the country agree: ,1.0
124,The American Bar Association gave Judge Garland its highest rating. Senate leaders: #DoYourJob and fill the #SCOTUS vacancy. ,1.0
125,Denying climate change is dangerous. Join @OFA supporters in standing up for bold action now: ,1.0
126,"Cynics, take note: When we #ActOnClimate, we build a stronger future. ",1.0
127,"""That’s how we will overcome the challenges we face: by unleashing the power of all of us for all of us."" Read more: ",1.0
128,Check out the most recent editorial boards calling on Senate leaders to vote on Judge Garland: ,1.0
129,"Senate leaders have undercut the functionality of the Supreme Court, and that's unacceptable. #DoYourJob ",1.0
130,Senate leaders' political games are handicapping the Supreme Court—and judgeships across the country. ,1.0
131,"RT @WIRED: After eight years in office, @POTUS remains optimistic about the world's future. His essay as WIRED’s guest editor: ",1.0
132,LIVE: President Obama is speaking at a reception celebrating #HispanicHeritageMonth. ,1.0
133,"RT @WhiteHouse: In honor of #HispanicHeritageMonth, we celebrate the progress that Hispanic Americans have made under @POTUS: ",1.0
134,Support the bold steps we're taking against climate change. Say you're ready to #ActOnClimate: ,1.0
135,"Last week, more than 190 countries reached a landmark deal to reduce carbon pollution from aviation. ",1.0
136,Let's leave our children and grandchildren a planet that's healthier than the one we have today. #ActOnClimate ,1.0
137,Climate change's effects are devastating. Denying the science behind it does nothing to help. ,1.0
138,"""On behalf of Michelle and our family, G’mar Chatimah Tovah."" —President Obama #YomKippur",1.0
139,"""LGBT individuals deserve to know their country stands beside them."" —President Obama #NationalComingOutDay ",1.0
140,The Supreme Court must remain above politics. Judge Garland needs a hearing and a vote. #DoYourJob ,1.0
141,Don't stand idly by while Senate leaders continue to block Judge Garland from a fair hearing and vote: ,1.0
142,"Judge Garland is just as qualified now as he was in 1997, Senate leaders. It's time to #DoYourJob. ",1.0
143,Dispel misinformation with facts from the @OFA Truth Team. ,1.0
144,"The uninsured rate is the lowest it's been in decades, thanks to #Obamacare. Spread the word. https://t.co/cxdbkiOqbq ",1.0
145,Deadline tonight—help rein in payday lenders that succeed by targeting vulnerable Americans: ,1.0
146,The Obama administration and @CFPB are working to protect consumers and #StopTheDebtTrap. ,1.0
147,"Our economy is on a better, stronger course. ",1.0
148,The economic progress we've made is undeniable—let's keep it up. ,1.0
149,Check out President Obama's essay in @TheEconomist on the unique challenges the American economy faces. ,1.0
150,"The economy added 156,000 jobs in September—extending the longest streak of total job growth on record.",1.0
151,ICYMI: Read about the historic #ParisAgreement and what it means for the fight to #ActOnClimate. ,1.0
152,"RT @WhiteHouse: This is #SXSL: The White House festival of ideas, art, and action. Take a peek inside: https://t.co/BbvvMEaQTF ",1.0
153,The cost of clean energy technology dropped significantly over the last eight years. Get the chart: ,1.0
154,This historic step in the fight to #ActOnClimate came faster than anyone predicted. ,1.0
155,"""Today is a historic day in the fight to protect our planet for future generations."" —President Obama #ActOnClimate ",1.0
156,LIVE: President Obama is delivering a statement on the Paris Climate Agreement. ,1.0
157,Read from @NYTopinion about why filling the Supreme Court vacancy is crucial for our democracy: ,1.0
158,Enough is enough. Say it's time for Senate leaders to get to work: ,1.0
159,"""Everybody cares about their kids, their grandkids, and the kind of world we pass on to them."" —President Obama ",1.0
160,Take what matters with you. https://t.co/E0hXWSu1q3 ,1.0
161,"We've come a long way, but the fight for fairness and an economy that works for everyone continues. ",1.0
162,RT @NatGeoChannel: Tonight @POTUS will be joined by @LeoDiCaprio for a conversation on combating climate change: ,1.0
163,Side-by-side for 24 years. Here's to many more. #HappyAnniversary ,1.0
164,"RT @WhiteHouse: Today, @POTUS is bringing something new to the South Lawn. Find out why: ",1.0
165,Facts matter. Stay informed with the @OFA Truth Team: ,1.0
166,"RT @OFA: ""Since I took office, another ten million private-sector workers have gained paid sick leave."" —President Obama ",1.0
167,"In the weekly address, President Obama discusses why access to paid leave is so important. ",1.0
168,Parents shouldn't have to choose between a paycheck and taking care of a sick child at home. #LeadOnLeave ,1.0
169,"After thirty years in Congress, Senator, this should not be your proudest accomplishment. https://t.co/FwGAJsBCoo #DoYourJob ",1.0
170,We need a fully functioning Supreme Court. Speak up if you agree it's time for a hearing and a vote: ,1.0
171,"There has never been a more qualified nominee, Senate leaders. He deserves a fair hearing and a vote. #DoYourJob ",1.0
172,It's the Senate's job to fairly consider Supreme Court nominees. Their refusal to do so is unacceptable: ,1.0
173,"""Everybody gets sick."" Check out what President Obama is doing to extend access to paid sick leave: ",1.0
174,RT @ErnestMoniz: THIS is what a #CleanEnergy revolution looks like. New report out today ? https://t.co/o13p5fPNDg #ActOnClimate ,1.0
175,Never underestimate the strength and resilience of the American economy. ,1.0
176,RT @Slate: President Obama answers Slate’s questions about his administration’s new rule extending paid sick leave: ,1.0
177,The @OFA Truth Team makes it easy to stay informed. Join today: ,1.0
178,"This is no accident—we're making a comeback because together, we've fought hard to support American families. ",1.0
179,We're better off than we were eight years ago. ,1.0
180,"Household incomes are up, and the poverty rate is down across all demographics. ",1.0
181,"As long as Senate leaders keep refusing to do their jobs, @OFA supporters will continue speaking out against their obstruction. #DoYourJob ",1.0
182,Senate leaders have blocked Judge Garland's hearing for over six months now. Keep pushing: ,1.0
183,"Important, tough conversations require solid facts. Get them from the @OFA Truth Team: https://t.co/5YH9zVeayn ",1.0
184,"These are high praises from the American Bar Association—and yet, Senate leaders refuse to even consider Judge Garland. #MerricksMerits ",1.0
185,Senate leaders' unprecedented obstruction of the Supreme Court nomination must end. Your voice matters: ,1.0
186,The American people are waiting for Senate leaders to do their jobs. ,1.0
187,Senate leaders have blocked Judge Garland's hearing for over six months now. Keep pushing: ,1.0
188,"Senate leaders need to work for the good of the American people, not seek out political points. ",1.0
189,Watch President Obama and @CEAChair Jason Furman discuss the positive gains the American economy has made. ,1.0
190,Here are 16 broken records we shouldn't be proud of. ,1.0
191,Stay informed. Stay engaged. Speak up. Join the @OFA Truth Team: ,1.0
192,"Another record broken: 16 months in a row of undeniable, record-breaking heat.
",1.0
193,Happy #FirstDayofFall. ,1.0
194,We can't sit idly by. Climate change is likely to threaten our national security—we must act now. https://t.co/HwnK53B8Zi #ActOnClimate ,1.0
195,Judge Garland is highly qualified for the bench—even some Senate leaders who are now blocking his hearing have agreed. #MerricksMerits ,1.0
196,Senate leaders' blind obstruction of Judge Garland's nomination sets a dangerous precedent. We can't stand idly by. ,1.0
197,"Enough of the shameless partisanship, Senators. #DoYourJob and fill the Supreme Court vacancy. ",1.0
198,Help keep the pressure on Senate leaders to give Judge Garland a fair hearing before their next recess. ,1.0
199,The American Bar Association gave Judge Garland its highest possible rating. He deserves a hearing and a vote. #MerricksMerits ,1.0
200,Thank you Rand! ,0.0
201,New home sales reach a 10 year high. Stock Market has more record gains. Hopefully Republican Senators will give us the much needed Tax Cuts to keep it all going! Democrats want big Tax Increases.,0.0
202,"The Tax Cut Bill is coming along very well, great support. With just a few changes, some mathematical, the middle class and job producers can get even more in actual dollars and savings and the pass through provision becomes simpler and really works well!",0.0
203,"The good news is that their ratings are terrible, nobody cares! ",0.0
204,"We should have a contest as to which of the Networks, plus CNN and not including Fox, is the most dishonest, corrupt and/or distorted in its political coverage of your favorite President (me). They are all bad. Winner to receive the FAKE NEWS TROPHY!",0.0
205,"Back in D.C., big week for Tax Cuts and many other things of great importance to our Country.  Senate Republicans will hopefully come through for all of us. The Tax Cut Bill is getting better and better. The end result will be great for ALL!",0.0
206,"Since the first day I took office, all you hear is the phony Democrat excuse for losing the election, Russia, Russia,Russia.  Despite this I have the economy booming and have possibly done more than any 10 month President. MAKE AMERICA GREAT AGAIN!",0.0
207,I endorsed Luther Strange in the Alabama Primary. He shot way up in the polls but it wasn’t enough. Can’t let Schumer/Pelosi win this race. Liberal Jones would be BAD!,0.0
208,"The last thing we need in Alabama and the U.S. Senate is a Schumer/Pelosi puppet who is WEAK on Crime, WEAK on the Border, Bad for our Military and our great Vets, Bad for our 2nd Amendment, AND WANTS TO RAISES TAXES TO THE SKY. Jones would be a disaster!",0.0
209,"Wow, even I didn’t realize we did so much. Wish the Fake News would report! Thank you. ",0.0
210,".@FoxNews is MUCH more important in the United States than CNN, but outside of the U.S., CNN International is still a major source of (Fake) news, and they represent our Nation to the WORLD very poorly. The outside world does not see the truth from them!",0.0
211,"Check out the recent Editorial in the Wall Street Journal @WSJ about what a complete disaster the @CFPB has been under its leader from previous Administration, who just quit!",0.0
