,data_tweets,data_labels
376,....This is real collusion and dishonesty. Major violation of Campaign Finance Laws and Money Laundering - where is our Justice Department?,0.0
377,Donna Brazile just stated the DNC RIGGED the system to illegally steal the Primary from Bernie Sanders. Bought and paid for by Crooked H....,0.0
378,"Great Tax Cut rollout today. The lobbyists are storming Capital Hill, but the Republicans will hold strong and do what is right for America!",0.0
379,"Today, it was my pleasure and great honor to announce my nomination of Jerome Powell to be the next Chairman of the @FederalReserve. ",0.0
380,"Broadcom's move to America=$20 BILLION of annual rev into U.S.A., $3+ BILLION/yr. in research/engineering &amp; $6 BILLION/yr. in manufacturing. ",0.0
381,"Today, we are thrilled to welcome @Broadcom CEO Hock Tan to the WH to announce he is moving their HQ’s from Singapore back to the U.S.A..... ",0.0
382,Congress must end chain migration so that we can have a system that is SECURITY BASED! We need to make AMERICA SAFE! #USA?? ,0.0
383,I am calling on Congress to TERMINATE the diversity visa lottery program that presents significant vulnerabilities to our national security. ,0.0
384,"Congratulations to the Houston @Astros, 2017 #WorldSeries Champions??#HoustonStrong #EarnHistory ",0.0
385,...There is also something appropriate about keeping him in the home of the horrible crime he committed. Should move fast. DEATH PENALTY!,0.0
386,Would love to send the NYC terrorist to Guantanamo but statistically that process takes much longer than going through the Federal system...,0.0
387,"NYC terrorist was happy as he asked to hang ISIS flag in his hospital room. He killed 8 people, badly injured 12. SHOULD GET DEATH PENALTY!",0.0
388,"Great mtg w/ @Cabinet today. Tomorrow, I will be announcing the new head of the Fed. I think you will be extremely impressed by this person! ",0.0
389,"Happy birthday to @garyplayer, a truly great Champion and Person!",0.0
390,It is finally happening for our great clean coal miners! ,0.0
391,The United States will be immediately implementing much tougher Extreme Vetting Procedures. The safety of our citizens comes first!,0.0
392,Just spoke to President Macri of Argentina about the five proud and wonderful men killed in the West Side terror attack. God be with them!,0.0
393,"CHAIN MIGRATION must end now! Some people come in, and they bring their whole family with them, who can be truly evil. NOT ACCEPTABLE! ",0.0
394,@SenateMajLdr @SenateGOP ...and Appeals Court Judges at a record clip! Our courts are rapidly changing for the better!,0.0
395,Thanks to @SenateMajLdr McConnell and the @SenateGOP we are appointing high-quality Federal District...,0.0
396,"Thank you to the GREAT NYPD, First Responders and all govt officials for having handled the terrible West Side attack so professionally! ",0.0
397,@NYGovCuomo @NYCMayor ...fully supports any and all of their efforts with respect to the West Side attack. #NYCStrong,0.0
398,Just spoke with @NYGovCuomo and @NYCMayor de Blasio to let them know that the federal government...,0.0
399,We mourn the horrifying terrorist attack in NYC. All of America is praying and grieving for the families who lost their precious loved ones. ,0.0
